[{"aliases":[],"canonical_name":"Solstice Mathematics Workshop","entity_id":"event:solstice_workshop","kind":"event","registry_version":"demo-v1"},{"aliases":[],"canonical_name":"Aylin Demo","entity_id":"person:aylin_demo","kind":"person","registry_version":"demo-v1"},{"aliases":[],"canonical_name":"Bora Example","entity_id":"person:bora_example","kind":"person","registry_version":"demo-v1"},{"aliases":[],"canonical_name":"Cem Sample","entity_id":"person:cem_sample","kind":"person","registry_version":"demo-v1"}]
